date,issue_number,headline,section,type,text_excerpt
Enero 15 de 1916.,,DESDE ETEN,Local,article,"No todo es noble, ni todo agradecido. Hay quienes se juzgan dignos de ocupar puestos públicos, de allí lo mismo les dá resultar Alcalde o Gobernador, y para ello envian telegramas á Lima, se empeñan en Chiclayo, buscan padrinos y, rada en dos platos..."
Enero 15 de 1916.,,Cincelazos,Variedades,other,
Enero 15 de 1916.,,CUENTO DE LA GUERRA,Variedades,article,"La noche del 2 de Setiembre. -Sí -Será algun oficial que está en observación. ¿Si hicieras un disparo? Oye, Virginia...........Creo que no debemos oponer resistencia. ¿Qué podemos hacer contra un regimiento?......"
Enero 15 de 1916.,,COOPERATIVA WIZARD,Local,article,"Ante el Notario Público sefior José María Arbulu Balcazar, ly jos se da, J S. Chirinos, Pedro I. Çusdra, Enrique Mulleir, R, S. Viteri y José N. Carranza, se verificaron los siguientes sorteos de la coopera tiva Wizard."
Enero 15 de 1916.,,"FOTOGRAFIA ""América""",Publicidad,advertisement,ALTOS DEL HOTEL ROYAL NO.[41 En este establecimiento fotográfia co se hace toda clase de trabajos sin competencia. Especialidad en tarjetas postales y retratos al platino. Vende cámaras de todo tamaño y así mismo materiales de todo clase...
Enero 15 de 1916.,,SOMBREROS Ade señora de última moda,Publicidad,advertisement,"MADAME DEILLE Modista Parisiense Confecciona tuoda clase de sombreros para señoras, segoritas y niños para lo cual cuenta con un gran surtido de adornos y materiales, y los más recientes figurines de la estación."
Enero 15 de 1916.,,despertaron sobresaltados.,Variedades,other,"El sol matinal llegaba las habitaciones con sus rayos. Juanita, asom ada á la ventana; señalaba algo en el jardín."
